{
  "week": 39,
  "year": 2026,
  "cursorTreatment": "highlight",
  "scrollBehavior": "standard",
  "hoverBehavior": "depth-reveal",
  "pageTransition": "crossfade",
  "motionIntensity": "subtle",
  "navigationBehavior": "stable",
  "storytellingStyle": "panel-sequence",
  "heroInteraction": "stacked-type gravity well: hover or scroll concentrates weight on the primary line while supporting lines recede to outline; pine accent marks the active line only",
  "reducedMotionFallback": "static stacked hierarchy and outline states; no weight morph, pointer shift, or crossfade staging; last-frame composition only"
}
